{
  "schemaVersion": 1,
  "fixtureVersion": "pr-a-v1",
  "title": "PDF quality audit PR A compact baseline",
  "profiles": {
    "pr-a-local": {
      "lane": "local",
      "maximumConcurrency": 1,
      "maximumGetRequests": 0,
      "maximumPostRequests": 24,
      "startSpacingMs": 0,
      "groups": [
        {
          "caseIds": [
            "A-BASIC-01", "A-FLOW-01", "A-FIXED-01", "A-TABLE-01", "A-ASSET-01",
            "A-TEXT-01", "A-FULL-ACADEMIC-01", "A-FULL-SERVICE-01", "A-FULL-JOB-01",
            "A-FULL-PATHWAY-01", "A-SEC-SCRIPT-01", "A-SEC-URL-01", "A-SEC-LOCAL-01",
            "A-UNSUP-MIXED-01", "A-ISO-PAIR-01", "A-DET-BASIC-01", "A-DET-FIXED-01"
          ],
          "repetitions": 1
        }
      ]
    },
    "pr-a-preview": {
      "lane": "preview",
      "maximumConcurrency": 1,
      "maximumGetRequests": 2,
      "maximumPostRequests": 7,
      "startSpacingMs": 2000,
      "groups": [
        { "caseIds": ["A-BASIC-01", "A-FLOW-01", "A-FIXED-01"], "repetitions": 1 },
        { "caseIds": ["A-FULL-ACADEMIC-01"], "repetitions": 3 },
        { "caseIds": ["A-SEC-URL-01"], "repetitions": 1 }
      ]
    },
    "pr-a-preview-basic-remediation": {
      "lane": "preview",
      "maximumConcurrency": 1,
      "maximumGetRequests": 2,
      "maximumPostRequests": 4,
      "startSpacingMs": 2000,
      "groups": [
        { "caseIds": ["A-BASIC-01"], "repetitions": 3 },
        { "caseIds": ["A-FLOW-01"], "repetitions": 1 }
      ]
    }
  },
  "cases": [
    {
      "id": "A-BASIC-01",
      "title": "Basic one-page Letter PDF",
      "category": "supported-basic-pdf",
      "capabilityIds": ["pdf.production", "pdf.structure", "pdf.text", "pdf.metadata", "pdf.visual.basic"],
      "expectedClass": "supported-and-expected-to-pass",
      "source": { "path": "tests/fixtures/one-page.html", "sha256": "9368e98a179d33925abc062e997c5ecc1de5a74e7d1d1af0576e1f91f382cbc3" },
      "request": {
        "filename": "A_BASIC_01.pdf", "storeResult": false, "storeHtml": false,
        "page": { "format": "Letter", "orientation": "portrait", "marginsInches": { "top": 0, "right": 0, "bottom": 0, "left": 0 } },
        "metadata": { "title": "Synthetic PDF audit A-BASIC-01", "author": "Urveska PDF Quality Audit", "subject": "Synthetic benchmark case A-BASIC-01", "keywords": ["synthetic", "quality-audit", "a-basic-01"] },
        "correlationId": "quality-audit-v1:a-basic-01"
      },
      "expected": {
        "responseKind": "pdf", "httpStatus": 200, "contentType": "application/pdf",
        "pageCount": { "minimum": 1, "maximum": 1 },
        "pageDimensions": [{ "widthPoints": 612, "heightPoints": 792 }],
        "requiredText": ["Generic one-page fixture", "This fictional document verifies a simple conversion."],
        "forbiddenText": ["Application Gold", "Application Blue"],
        "metadata": { "title": "Synthetic PDF audit A-BASIC-01", "author": "Urveska PDF Quality Audit", "subject": "Synthetic benchmark case A-BASIC-01", "keywords": ["synthetic", "quality-audit", "a-basic-01"] },
        "visualReferenceId": "A-BASIC-01-p1",
        "geometricExpectations": {
          "allPagesNonblank": true,
          "perPageRequiredText": [{ "pageNumber": 1, "text": ["Generic one-page fixture", "simple conversion"] }],
          "informationalNotes": ["The approved page-one reference checks visible placement inside the Letter page bounds."]
        }
      },
      "previewEligible": true,
      "evidenceRequirements": ["structure", "page-geometry", "text", "metadata", "visual-reference"]
    },
    {
      "id": "A-FLOW-01",
      "title": "Automatic flowing pagination",
      "category": "supported-basic-pdf",
      "capabilityIds": ["pdf.pagination.flow", "pdf.text.order", "pdf.geometry.letter"],
      "expectedClass": "supported-and-expected-to-pass",
      "source": { "path": "tests/fixtures/flowing-pages.html", "sha256": "0dfb321f4f9f7f0f0a38828f3c6f668d53f1cbc916be0f0aa26af355ace2283d" },
      "request": {
        "filename": "A_FLOW_01.pdf", "storeResult": false, "storeHtml": false,
        "page": { "format": "Letter", "orientation": "portrait", "marginsInches": { "top": 0, "right": 0, "bottom": 0, "left": 0 } },
        "metadata": { "title": "Synthetic PDF audit A-FLOW-01", "author": "Urveska PDF Quality Audit", "subject": "Synthetic benchmark case A-FLOW-01", "keywords": ["synthetic", "quality-audit", "a-flow-01"] },
        "correlationId": "quality-audit-v1:a-flow-01"
      },
      "expected": {
        "responseKind": "pdf", "httpStatus": 200, "contentType": "application/pdf",
        "pageCount": { "minimum": 6, "maximum": 6 },
        "pageDimensions": [{ "widthPoints": 612, "heightPoints": 792 }],
        "requiredText": ["Flowing page one", "Flowing page two", "Flowing page three"], "forbiddenText": [],
        "metadata": { "title": "Synthetic PDF audit A-FLOW-01", "author": "Urveska PDF Quality Audit", "subject": "Synthetic benchmark case A-FLOW-01", "keywords": ["synthetic", "quality-audit", "a-flow-01"] },
        "geometricExpectations": {
          "allPagesNonblank": true,
          "requiredTextOrder": ["Flowing page one", "Flowing page two", "Flowing page three"],
          "perPageRequiredText": [
            { "pageNumber": 1, "text": ["Flowing page one"] },
            { "pageNumber": 3, "text": ["Flowing page two"] },
            { "pageNumber": 5, "text": ["Flowing page three"] }
          ]
        }
      },
      "previewEligible": true,
      "evidenceRequirements": ["structure", "page-geometry", "text", "metadata"]
    },
    {
      "id": "A-FIXED-01",
      "title": "Three fixed page markers",
      "category": "supported-basic-pdf",
      "capabilityIds": ["pdf.pagination.fixed", "pdf.merge", "pdf.text.order"],
      "expectedClass": "supported-and-expected-to-pass",
      "source": { "path": "tests/fixtures/fixed-pages.html", "sha256": "1eca7dc1b55d9757b628859d1f3e7f2856b2f68568a9a55670a6f2977c936ad6" },
      "request": {
        "filename": "A_FIXED_01.pdf", "storeResult": false, "storeHtml": false,
        "page": { "format": "Letter", "orientation": "portrait", "marginsInches": { "top": 0, "right": 0, "bottom": 0, "left": 0 } },
        "metadata": { "title": "Synthetic PDF audit A-FIXED-01", "author": "Urveska PDF Quality Audit", "subject": "Synthetic benchmark case A-FIXED-01", "keywords": ["synthetic", "quality-audit", "a-fixed-01"] },
        "correlationId": "quality-audit-v1:a-fixed-01"
      },
      "expected": {
        "responseKind": "pdf", "httpStatus": 200, "contentType": "application/pdf",
        "pageCount": { "minimum": 3, "maximum": 3 }, "pageDimensions": [{ "widthPoints": 612, "heightPoints": 792 }],
        "requiredText": ["Fixed page one", "Fixed page two", "Fixed page three"], "forbiddenText": [],
        "metadata": { "title": "Synthetic PDF audit A-FIXED-01", "author": "Urveska PDF Quality Audit", "subject": "Synthetic benchmark case A-FIXED-01", "keywords": ["synthetic", "quality-audit", "a-fixed-01"] },
        "geometricExpectations": {
          "allPagesNonblank": true,
          "requiredTextOrder": ["Fixed page one", "Fixed page two", "Fixed page three"],
          "perPageRequiredText": [
            { "pageNumber": 1, "text": ["Fixed page one"] },
            { "pageNumber": 2, "text": ["Fixed page two"] },
            { "pageNumber": 3, "text": ["Fixed page three"] }
          ]
        }
      },
      "previewEligible": true,
      "evidenceRequirements": ["structure", "page-geometry", "text", "metadata"]
    },
    {
      "id": "A-TABLE-01",
      "title": "Long flowing table",
      "category": "supported-basic-pdf",
      "capabilityIds": ["pdf.table.pagination", "pdf.table.header-repeat", "pdf.table.wrapping"],
      "expectedClass": "supported-and-expected-to-pass",
      "source": { "path": "tests/quality-audit/fixtures/long-table.html", "sha256": "2edd39efd894606db99103c72fa6cfa71932afc767dde9bdf10526b2d2519a86" },
      "request": {
        "filename": "A_TABLE_01.pdf", "storeResult": false, "storeHtml": false,
        "page": { "format": "Letter", "orientation": "portrait", "marginsInches": { "top": 0.5, "right": 0.5, "bottom": 0.5, "left": 0.5 } },
        "metadata": { "title": "Synthetic PDF audit A-TABLE-01", "author": "Urveska PDF Quality Audit", "subject": "Synthetic benchmark case A-TABLE-01", "keywords": ["synthetic", "quality-audit", "a-table-01"] },
        "correlationId": "quality-audit-v1:a-table-01"
      },
      "expected": {
        "responseKind": "pdf", "httpStatus": 200, "contentType": "application/pdf",
        "pageCount": { "minimum": 2, "maximum": 8 }, "pageDimensions": [{ "widthPoints": 612, "heightPoints": 792 }],
        "requiredText": ["Synthetic Long Table Benchmark", "Row 01", "Row 60", "138.4"], "forbiddenText": [],
        "metadata": { "title": "Synthetic PDF audit A-TABLE-01", "author": "Urveska PDF Quality Audit", "subject": "Synthetic benchmark case A-TABLE-01", "keywords": ["synthetic", "quality-audit", "a-table-01"] },
        "visualReferenceId": "A-TABLE-01-p2",
        "geometricExpectations": {
          "allPagesNonblank": true,
          "requiredTextOrder": ["Row 01", "Row 21", "Row 44", "Row 60"],
          "repeatTextOnEveryPage": ["Observation", "Fictional value", "Review note"],
          "perPageRequiredText": [{ "pageNumber": 2, "text": ["Row 21", "Row 43"] }],
          "informationalNotes": ["The approved page-two reference checks representative wrapping and numeric alignment; broader table coverage is deferred."]
        }
      },
      "previewEligible": false,
      "evidenceRequirements": ["structure", "page-geometry", "text", "metadata", "visual-reference"]
    },
    {
      "id": "A-ASSET-01",
      "title": "Embedded assets on A4 landscape",
      "category": "supported-basic-pdf",
      "capabilityIds": ["pdf.asset.data-url", "pdf.svg", "pdf.css.background", "pdf.geometry.a4-landscape"],